userName,userKarma,commentContent,commentEmojis,sentimentScore
LakeLoverNo1,9,"Interesting.  Not sure of the source but based on the Dems reaction so far, there is no doubt that Trump struck a nerve with USAID.",[],0.1366
herplexed1467,31885,This is OUR FUCKING MONEY they are spending to enrich themselves. How is this not a MASSIVE scandal?,[],0.3412
Bedmonds129,27,"So you’ve hit the nail on the head, for real/permanent change, you’ve got to stop the politicians. Eagerly awaiting those changes.",[],0.1027
Wide_Wrongdoer4422,24798,"I'm kinda thinking Trump knew, and sent the wrecking ball there first.",[],0.0
smauseth,34228,I thought I paid attention.  I had no idea how insidious USAID actually is/was.  My mind is blown and waiting for someone to write the book.,[],-0.296
Substantial-Raise144,203,Dems heads are exploding 🤣🤣🤣 finally learn where my tax payer dollars are going!!,"['🤣', '🤣', '🤣']",0.8802
amadeus2626,328,"""Talked to a friend who has connections within the Democratic Party“.  Is that the highest bar that we have for a trusted information source? Shouldn’t the messages that are coming be vetted? Is it smart to believe everything that is presented, especially if the messaging is trying to justify breaking the law? Could it be that this type of polarizing messaging has a completely different purpose? When did the US stop having a healthy distrust of what all politicians said? Did someone find that 50 Mil USD in Condoms, that the Whitehouse said are being distributed in Gaza?",[],0.8253
ass_whiskers,5065,"Keep it coming baby! At this pace, this country will be completely different in 6 months and the dems won’t know what to do.",[],0.0
Grouchy-Capital3408,2834,The fact the deep state media and politicians are squealing so loudly as he does this proves that he is doing the right thing!,[],0.0
Klutzy_Carpenter_289,30683,"If you’ve seen Maxine Waters, Chuck Schumer et all they are losing their minds!",[],-0.4389
ruger6666,883,Lets keep saving our tax dollars and reduce the national debt!! Might even be able to reduce by cutting gov waste!,[],-0.7701
AdwokatDiabel,63078,"Let's break this ""report"" down... The Congress earmarks money to USAID.  USAID has a number of programs it supports.  These include distribution of food to countries impacted by natural disasters and such. 

To provide these services, they contract them out.  If that's the case, the paper trails for these contracts would've been public record this entire time. 

So either our party is unable to read and understand budget and contract reports or this news article is fake.  Given the lack of factual information, for example, any contract we can look at and scrutinize, I'm gonna assume that to be the case.",[],-0.1868
ModrnDayMasacre,25252,All the pardons are making sense now…,[],0.296
Comprehensive-Tell13,30341,U-said  funny 😄,['😄'],0.8126
smauseth,34228,"I live in NC, and one of my home subs is r/northcarolina. The day before, you could see advocacy for USAID and the sub getting reading for an information campaign.  I think that with the speed that the DOGE group is proceeding, It took those guys by surprise.  The Dems and their operatives were not ready for this.

I posted this article because it seems to fit what was going on.  Like anything else on Reddit, you have to question how it is relevant but again it seems to make sense.",[],0.3601
meconiumwastaken,912,"The source had no relevant information. Didn’t define USAID usage, or why dems care, pros or cons. Do you think we gain power and influence from aiding other countries or do you think we should keep our resources at home, third option keep aid at home and force other countries to allow our influence by brute force.  Policy rather than personality, would be a much better conversation.",[],0.8481
smauseth,34228,"What the US government has been good at lately in the last decade is programming you on what subjects to be outraged about.  If the data shows corruption and payoffs from USAID to elected politicians, I think that you will begin to see more anger.  The swamp creatures from both parties will need to be voted out of office or arrested depending on the severity of the crime.  At this point, the fact that they government is corrupt is a given.

Just remember, this is only week 3 of the new Trump administration.  I think that the new administration is moving with lightning speed.  I think that they'll get there.",[],-0.8588
LakeLoverNo1,9,Me too. I’m shocked I didn’t know more before last week.,[],-0.3182
AdwokatDiabel,63078,Are you a paid shill account?  Or do you not understand how the government works?,[],0.0
Kewkky,113548,"Unless they ratify things in the Constitution, a blue wave can wash everything away just as efficiently as this red wave washed away all their work. To keep everything the way Trump is changing it, permanent solutions need to be found. Unless that happens, dems and independents will band together four years from now, or even two years from now during midterms.",[],0.5267
everydayimchapulin,16060,"Our government wasn't built to change so quickly at the whims of one man. You should be concerned. It should not be so easy for our current president to dismantle so much of the government that was built up over several decades. 

The next president might not be one that aligns with your beliefs, but the precedent has now been set that the American president can act unilaterally, unimpeded, and cannot be held legally accountable for their actions. 

THAT is the biggest change. Congress and the Supreme Court will be meaningless institutions and the only true power in government will lie in the executive branch.",[],0.7702
smauseth,34228,"That would be something, wouldn't it, though?",[],0.0
LakeLoverNo1,9,"I think in general the Dems don’t know what hit them so far.   As soon as they start to mobilize on an issue, Trump hits them with the next one. I can’t wait to see the reaction to sending illegals and violent felons to El Salvador.",[],-0.5994
everydayimchapulin,16060,The propaganda machine didn't turn on until last week. You're shocked because there was nothing to be shocked about until you were fed curated and tailored information.,[],-0.3265
fromtybee,1638,What permanent solutions do you suggest ?,[],0.1779
LakeLoverNo1,9,"I’m shocked at all the stupid stuff our tax dollars paid.  I’m shocked that Biden hid all the stupid stuff his administration paid for - well, not really.  I’m shocked at the democrats response - almost like they’re still hiding dirty payments or something.",[],-0.8866
Jacinto1972,6090,"You left out the word ""*because*"" in your reply: 

""You're shocked because there was nothing to be shocked about ~~until~~ ***because*** you were fed curated and tailored information.""

That's better...",[],0.374
everydayimchapulin,16060,What do you suggest?,[],0.0
